{
  "$schema": "schemas/entities/person_registry.schema.json",
  "schema_version": "1.0.2",
  "created_at": "2026-01-01T00:00:00Z",
  "last_modified": "2026-09-26T11:15:00Z",
  "total_persons": 62,
  "persons": [
    {
      "person_id": "IND-00000",
      "display_name": "Arthur Pendelton Sterling",
      "canonical_name": {
        "given": "Arthur",
        "middle": "Pendelton",
        "surname": "Sterling",
        "birth_year": {
          "year": 1961,
          "modifier": "EXACT"
        },
        "death_year": {
          "year": null,
          "modifier": "LIVING"
        }
      },
      "sex": "Male",
      "vitals": {
        "birth": {
          "date": {
            "date_start": "1961-12-01",
            "modifier": "EXACT",
            "raw_text": "1 Dec 1961"
          },
          "place": {
            "verbatim": "Harrisburg, Dauphin, Pennsylvania, USA",
            "standardized": "Harrisburg, Dauphin County, Pennsylvania, USA",
            "details": {
              "local_jurisdiction": "Harrisburg",
              "county": "Dauphin County",
              "state_or_province": "Pennsylvania",
              "country": "USA"
            }
          }
        },
        "death": {
          "date": {
            "date_start": null,
            "modifier": "LIVING",
            "raw_text": null
          },
          "place": null
        }
      },
      "associated_people": [
        {
          "person_id": "IND-00019",
          "role": "FATH"
        },
        {
          "person_id": "IND-00023",
          "role": "MOTH"
        },
        {
          "person_id": "IND-00029",
          "role": "SPOU"
        },
        {
          "person_id": "IND-00031",
          "role": "SPOU"
        },
        {
          "person_id": "IND-00037",
          "role": "CHIL"
        },
        {
          "person_id": "IND-00041",
          "role": "CHIL"
        },
        {
          "person_id": "IND-00043",
          "role": "CHIL"
        },
        {
          "person_id": "IND-00047",
          "role": "CHIL"
        }
      ],
      "unions": [
        {
          "spouse_id": "IND-00029",
          "status": "DIVORCED",
          "marriage_date": {
            "date_start": "1983-05-14",
            "modifier": "EXACT",
            "raw_text": "14 May 1983"
          },
          "end_date": {
            "date_start": "1985-08-20",
            "modifier": "EXACT",
            "raw_text": "20 Aug 1985"
          },
          "place": {
            "verbatim": "Harrisburg, Dauphin, Pennsylvania, USA",
            "standardized": "Harrisburg, Dauphin County, Pennsylvania, USA",
            "details": {
              "local_jurisdiction": "Harrisburg",
              "county": "Dauphin County",
              "state_or_province": "Pennsylvania",
              "country": "USA"
            }
          },
          "notes": "Terminated by divorce decree"
        },
        {
          "spouse_id": "IND-00031",
          "status": "MARRIED",
          "marriage_date": {
            "date_start": "1986-03-22",
            "modifier": "EXACT",
            "raw_text": "22 Mar 1986"
          },
          "end_date": null,
          "place": {
            "verbatim": "Carlisle, PA",
            "standardized": "Carlisle, Cumberland County, Pennsylvania, USA",
            "details": {
              "local_jurisdiction": "Carlisle",
              "county": "Cumberland County",
              "state_or_province": "Pennsylvania",
              "country": "USA"
            }
          },
          "notes": "Current marriage"
        }
      ]
    },
    {
      "person_id": "IND-00029",
      "display_name": "Eleanor Margaret Sinclair",
      "canonical_name": {
        "given": "Eleanor",
        "middle": "Margaret",
        "surname": "Sinclair",
        "birth_year": {
          "year": 1963,
          "modifier": "EXACT"
        },
        "death_year": {
          "year": null,
          "modifier": "LIVING"
        }
      },
      "sex": "Female",
      "vitals": {
        "birth": {
          "date": {
            "date_start": "1963-04-12",
            "modifier": "EXACT",
            "raw_text": "12 Apr 1963"
          },
          "place": {
            "verbatim": "Harrisburg, Dauphin, Pennsylvania, USA",
            "standardized": "Harrisburg, Dauphin County, Pennsylvania, USA",
            "details": {
              "local_jurisdiction": "Harrisburg",
              "county": "Dauphin County",
              "state_or_province": "Pennsylvania",
              "country": "USA"
            }
          }
        },
        "death": {
          "date": {
            "date_start": null,
            "modifier": "LIVING",
            "raw_text": null
          },
          "place": null
        }
      },
      "associated_people": [
        {
          "person_id": "IND-00179",
          "role": "FATH"
        },
        {
          "person_id": "IND-00181",
          "role": "MOTH"
        },
        {
          "person_id": "IND-00000",
          "role": "SPOU"
        },
        {
          "person_id": "IND-00037",
          "role": "CHIL"
        }
      ],
      "unions": [
        {
          "spouse_id": "IND-00000",
          "status": "DIVORCED",
          "marriage_date": {
            "date_start": "1983-05-14",
            "modifier": "EXACT",
            "raw_text": "14 May 1983"
          },
          "end_date": {
            "date_start": "1985-08-20",
            "modifier": "EXACT",
            "raw_text": "20 Aug 1985"
          },
          "place": {
            "verbatim": "Harrisburg, Dauphin, Pennsylvania, USA",
            "standardized": "Harrisburg, Dauphin County, Pennsylvania, USA",
            "details": {
              "local_jurisdiction": "Harrisburg",
              "county": "Dauphin County",
              "state_or_province": "Pennsylvania",
              "country": "USA"
            }
          },
          "notes": "Reciprocal divorce decree"
        }
      ]
    },
    {
      "person_id": "IND-00037",
      "display_name": "Julian Sinclair Sterling",
      "canonical_name": {
        "given": "Julian",
        "middle": "Sinclair",
        "surname": "Sterling",
        "birth_year": {
          "year": 1984,
          "modifier": "EXACT"
        },
        "death_year": {
          "year": null,
          "modifier": "LIVING"
        }
      },
      "sex": "Male",
      "vitals": {
        "birth": {
          "date": {
            "date_start": "1984-06-18",
            "modifier": "EXACT",
            "raw_text": "18 Jun 1984"
          },
          "place": {
            "verbatim": "Harrisburg, Dauphin, Pennsylvania, USA",
            "standardized": "Harrisburg, Dauphin County, Pennsylvania, USA",
            "details": {
              "local_jurisdiction": "Harrisburg",
              "county": "Dauphin County",
              "state_or_province": "Pennsylvania",
              "country": "USA"
            }
          }
        },
        "death": {
          "date": {
            "date_start": null,
            "modifier": "LIVING",
            "raw_text": null
          },
          "place": null
        }
      },
      "associated_people": [
        {
          "person_id": "IND-00000",
          "role": "FATH"
        },
        {
          "person_id": "IND-00029",
          "role": "MOTH"
        }
      ],
      "unions": []
    },
    {
      "person_id": "IND-00031",
      "display_name": "Clara Josephine Holloway",
      "canonical_name": {
        "given": "Clara",
        "middle": "Josephine",
        "surname": "Holloway",
        "birth_year": {
          "year": 1964,
          "modifier": "EXACT"
        },
        "death_year": {
          "year": null,
          "modifier": "LIVING"
        }
      },
      "sex": "Female",
      "vitals": {
        "birth": {
          "date": {
            "date_start": "1964-08-22",
            "modifier": "EXACT",
            "raw_text": "22 Aug 1964"
          },
          "place": {
            "verbatim": "Carlisle, PA",
            "standardized": "Carlisle, Cumberland County, Pennsylvania, USA",
            "details": {
              "local_jurisdiction": "Carlisle",
              "county": "Cumberland County",
              "state_or_province": "Pennsylvania",
              "country": "USA"
            }
          }
        },
        "death": {
          "date": {
            "date_start": null,
            "modifier": "LIVING",
            "raw_text": null
          },
          "place": null
        }
      },
      "associated_people": [
        {
          "person_id": "IND-00191",
          "role": "FATH"
        },
        {
          "person_id": "IND-00193",
          "role": "MOTH"
        },
        {
          "person_id": "IND-00000",
          "role": "SPOU"
        },
        {
          "person_id": "IND-00041",
          "role": "CHIL"
        },
        {
          "person_id": "IND-00043",
          "role": "CHIL"
        },
        {
          "person_id": "IND-00047",
          "role": "CHIL"
        }
      ],
      "unions": [
        {
          "spouse_id": "IND-00000",
          "status": "MARRIED",
          "marriage_date": {
            "date_start": "1986-03-22",
            "modifier": "EXACT",
            "raw_text": "22 Mar 1986"
          },
          "end_date": null,
          "place": {
            "verbatim": "Carlisle, PA",
            "standardized": "Carlisle, Cumberland County, Pennsylvania, USA",
            "details": {
              "local_jurisdiction": "Carlisle",
              "county": "Cumberland County",
              "state_or_province": "Pennsylvania",
              "country": "USA"
            }
          },
          "notes": "Reciprocal marriage record"
        }
      ]
    },
    {
      "person_id": "IND-00041",
      "display_name": "Beatrice May Holloway",
      "canonical_name": {
        "given": "Beatrice",